{
  "$schema": "https://json-schema.org/draft/2020-12/schema",
  "$id": "https://sesslint.dev/schemas/sesslint.outcome-contract.v1.json",
  "title": "SessLint OutcomeGuard Contract",
  "description": "Declarative outcome contract. Structural shape only: cross-field rules (bound order, on_time needs due, duplicate ids, at least one decisive condition) and number spelling (an integer field must be written without a fraction or exponent; a JSON number may have at most 4300 characters) are enforced by sesslint.outcome.contract_from_dict and load_contract.",
  "type": "object",
  "additionalProperties": false,
  "required": ["schema_version", "name", "version", "key", "conditions"],
  "properties": {
    "schema_version": {"const": "sesslint.outcome-contract/v1"},
    "name": {"$ref": "#/$defs/text"},
    "version": {"type": "string", "minLength": 1, "maxLength": 64},
    "description": {"$ref": "#/$defs/text"},
    "key": {
      "type": "object", "additionalProperties": false, "required": ["source", "target"],
      "properties": {"source": {"$ref": "#/$defs/key_fields"}, "target": {"$ref": "#/$defs/key_fields"}}
    },
    "eligibility": {"$ref": "#/$defs/predicates"},
    "due": {
      "anyOf": [
        {"type": "null"},
        {"type": "object", "additionalProperties": false, "required": ["source_time_field", "within_seconds"],
         "properties": {
           "source_time_field": {"$ref": "#/$defs/field"},
           "within_seconds": {"description": "A JSON integer written without a fraction or exponent: 60.0 passes this schema but is rejected by contract_from_dict.", "type": "integer", "minimum": 0, "maximum": 316224000}
         }}
      ]
    },
    "conditions": {"type": "array", "minItems": 1, "maxItems": 64, "items": {"$ref": "#/$defs/condition"}}
  },
  "$defs": {
    "text": {"type": "string", "minLength": 1, "maxLength": 2000, "pattern": "\\S"},
    "field": {"type": "string", "minLength": 1, "maxLength": 256},
    "id": {"type": "string", "pattern": "^[A-Za-z0-9][A-Za-z0-9._-]{0,63}$"},
    "scalar": {"type": ["string", "number", "boolean", "null"]},
    "values": {"type": "array", "minItems": 1, "maxItems": 1000, "items": {"$ref": "#/$defs/scalar"}},
    "allowed_values": {"description": "one_of and route values: no null, since a null field never matches them.", "type": "array", "minItems": 1, "maxItems": 1000, "items": {"type": ["string", "number", "boolean"]}},
    "count_bound": {"description": "A JSON integer written without a fraction or exponent: 1.0 passes this schema but is rejected by contract_from_dict.", "type": "integer", "maximum": 1000000},
    "normalize": {"type": "array", "uniqueItems": true, "items": {"enum": ["trim", "casefold"]}},
    "key_fields": {
      "anyOf": [
        {"$ref": "#/$defs/field"},
        {"type": "array", "minItems": 1, "maxItems": 8, "uniqueItems": true, "items": {"$ref": "#/$defs/field"}}
      ]
    },
    "predicates": {"type": "array", "maxItems": 32, "items": {"$ref": "#/$defs/predicate"}},
    "predicate": {
      "type": "object", "required": ["field", "op"],
      "oneOf": [
        {"additionalProperties": false, "properties": {"field": {"$ref": "#/$defs/field"}, "op": {"enum": ["present", "absent"]}}},
        {"additionalProperties": false, "required": ["value"], "properties": {"field": {"$ref": "#/$defs/field"}, "op": {"enum": ["eq", "ne"]}, "value": {"$ref": "#/$defs/scalar"}}},
        {"additionalProperties": false, "required": ["value"], "properties": {"field": {"$ref": "#/$defs/field"}, "op": {"enum": ["gt", "gte", "lt", "lte"]}, "value": {"type": "number"}}},
        {"additionalProperties": false, "required": ["values"], "properties": {"field": {"$ref": "#/$defs/field"}, "op": {"enum": ["in", "not_in"]}, "values": {"$ref": "#/$defs/values"}}}
      ]
    },
    "condition": {
      "type": "object", "required": ["id", "type"],
      "oneOf": [
        {"$ref": "#/$defs/branch"},
        {"additionalProperties": false, "required": ["conditions"], "properties": {
          "id": {"$ref": "#/$defs/id"}, "type": {"const": "any_of"}, "advisory": {"type": "boolean"},
          "disabled": {"$ref": "#/$defs/text"}, "description": {"$ref": "#/$defs/text"},
          "conditions": {"type": "array", "minItems": 2, "items": {"$ref": "#/$defs/branch"}}
        }}
      ]
    },
    "branch": {
      "type": "object", "required": ["id", "type"],
      "oneOf": [
        {"additionalProperties": false, "properties": {
          "id": {"$ref": "#/$defs/id"}, "type": {"const": "exists"}, "advisory": {"type": "boolean"},
          "disabled": {"$ref": "#/$defs/text"}, "description": {"$ref": "#/$defs/text"}}},
        {"additionalProperties": false, "properties": {
          "id": {"$ref": "#/$defs/id"}, "type": {"const": "count"}, "advisory": {"type": "boolean"},
          "disabled": {"$ref": "#/$defs/text"}, "description": {"$ref": "#/$defs/text"},
          "min": {"$ref": "#/$defs/count_bound", "minimum": 0}, "max": {"$ref": "#/$defs/count_bound", "minimum": 1}}},
        {"additionalProperties": false, "required": ["field"], "properties": {
          "id": {"$ref": "#/$defs/id"}, "type": {"const": "required"}, "advisory": {"type": "boolean"},
          "disabled": {"$ref": "#/$defs/text"}, "description": {"$ref": "#/$defs/text"},
          "field": {"$ref": "#/$defs/field"}, "allow_null": {"type": "boolean"}, "allow_empty": {"type": "boolean"}}},
        {"additionalProperties": false, "required": ["field", "kind"], "properties": {
          "id": {"$ref": "#/$defs/id"}, "type": {"const": "type"}, "advisory": {"type": "boolean"},
          "disabled": {"$ref": "#/$defs/text"}, "description": {"$ref": "#/$defs/text"},
          "field": {"$ref": "#/$defs/field"}, "kind": {"enum": ["string", "integer", "number", "boolean", "date-time"]}}},
        {"additionalProperties": false, "required": ["field", "values"], "properties": {
          "id": {"$ref": "#/$defs/id"}, "type": {"const": "one_of"}, "advisory": {"type": "boolean"},
          "disabled": {"$ref": "#/$defs/text"}, "description": {"$ref": "#/$defs/text"},
          "field": {"$ref": "#/$defs/field"}, "values": {"$ref": "#/$defs/allowed_values"}, "normalize": {"$ref": "#/$defs/normalize"}}},
        {"additionalProperties": false, "required": ["field", "source_field"], "properties": {
          "id": {"$ref": "#/$defs/id"}, "type": {"const": "equals"}, "advisory": {"type": "boolean"},
          "disabled": {"$ref": "#/$defs/text"}, "description": {"$ref": "#/$defs/text"},
          "field": {"$ref": "#/$defs/field"}, "source_field": {"$ref": "#/$defs/field"}, "normalize": {"$ref": "#/$defs/normalize"}}},
        {"additionalProperties": false, "required": ["field"], "anyOf": [{"required": ["min"]}, {"required": ["max"]}], "properties": {
          "id": {"$ref": "#/$defs/id"}, "type": {"const": "range"}, "advisory": {"type": "boolean"},
          "disabled": {"$ref": "#/$defs/text"}, "description": {"$ref": "#/$defs/text"},
          "field": {"$ref": "#/$defs/field"}, "min": {"type": ["number", "null"]}, "max": {"type": ["number", "null"]}}},
        {"additionalProperties": false, "required": ["field", "values", "when"], "properties": {
          "id": {"$ref": "#/$defs/id"}, "type": {"const": "route"}, "advisory": {"type": "boolean"},
          "disabled": {"$ref": "#/$defs/text"}, "description": {"$ref": "#/$defs/text"},
          "field": {"$ref": "#/$defs/field"}, "values": {"$ref": "#/$defs/allowed_values"}, "normalize": {"$ref": "#/$defs/normalize"},
          "when": {"type": "array", "minItems": 1, "maxItems": 32, "items": {"$ref": "#/$defs/predicate"}}}},
        {"additionalProperties": false, "required": ["basis", "field"], "properties": {
          "id": {"$ref": "#/$defs/id"}, "type": {"const": "on_time"}, "advisory": {"type": "boolean"},
          "disabled": {"$ref": "#/$defs/text"}, "description": {"$ref": "#/$defs/text"},
          "basis": {"const": "target_time"}, "field": {"$ref": "#/$defs/field"}}},
        {"additionalProperties": false, "required": ["basis"], "properties": {
          "id": {"$ref": "#/$defs/id"}, "type": {"const": "on_time"}, "advisory": {"type": "boolean"},
          "disabled": {"$ref": "#/$defs/text"}, "description": {"$ref": "#/$defs/text"},
          "basis": {"const": "observation"}}}
      ]
    }
  }
}
